{
  "incident_id": "019a2b3c-4d5e-7f00-8a00-000000000023",
  "shift_id": "019a2b3c-4d5e-7f00-8a00-000000000020",
  "category": "damaged_tag",
  "note": "A raktár hátsó ajtaja nyitva volt.",
  "lat_e7": 474979100,
  "lng_e7": 190402300,
  "accuracy_dm": 80,
  "nearest_checkpoint_id": "019a2b3c-4d5e-7f00-8a00-000000000005",
  "scan_id": "019a2b3c-4d5e-7f00-8a00-000000000022",
  "media": [
    {
      "id": "019a2b3c-4d5e-7f00-8a00-000000000024",
      "sha256": "677e912d1a8aa1101fe271bab42c91be187bd6076ff1281335db85e3477f6ce1"
    }
  ]
}
